Sheet: note_table
A1: Samplefreq | B1: sampleperiod | C1: Counter | D1: Counterbits
A2: 100000 | B2: of:=1/[.A2] -> 0.00001 | C2: of:=2^[.$D$2] -> 4294967296 | D2: 32
C4: freq | D4: period | E4: stepratio | F4: stepsize | G4: stepround | H4: error
A5: C -1 | B5: 0 | C5: 8.176 | D5: of:=1/[.C5] -> 0.122309197651663 | E5: of:=[.$B$2]/[.D5] -> 0.00008176 | F5: of:=[.$C$2]*[.E5] -> 351156.52612096 | G5: of:=ROUND([.F5]) -> 351157 | H5: of:=(([.G5]-[.F5])/[.F5]) -> 0.00000134948094276516
A6: C# -1 | B6: 1 | C6: 8.662 | D6: of:=1/[.C6] -> 0.115446779034865 | E6: of:=[.$B$2]/[.D6] -> 0.00008662 | F6: of:=[.$C$2]*[.E6] -> 372030.06717952 | G6: of:=ROUND([.F6]) -> 372030 | H6: of:=(([.G6]-[.F6])/[.F6]) -> -0.000000180575512618875
A7: D -1 | B7: 2 | C7: 9.177 | D7: of:=1/[.C7] -> 0.1089680723548 | E7: of:=[.$B$2]/[.D7] -> 0.00009177 | F7: of:=[.$C$2]*[.E7] -> 394149.14875392 | G7: of:=ROUND([.F7]) -> 394149 | H7: of:=(([.G7]-[.F7])/[.F7]) -> -0.000000377405153501451
A8: D# -1 | B8: 3 | C8: 9.723 | D8: of:=1/[.C8] -> 0.102848914943947 | E8: of:=[.$B$2]/[.D8] -> 0.00009723 | F8: of:=[.$C$2]*[.E8] -> 417599.67019008 | G8: of:=ROUND([.F8]) -> 417600 | H8: of:=(([.G8]-[.F8])/[.F8]) -> 0.000000789775336223024
A9: E -1 | B9: 4 | C9: 10.301 | D9: of:=1/[.C9] -> 0.0970779535967382 | E9: of:=[.$B$2]/[.D9] -> 0.00010301 | F9: of:=[.$C$2]*[.E9] -> 442424.58116096 | G9: of:=ROUND([.F9]) -> 442425 | H9: of:=(([.G9]-[.F9])/[.F9]) -> 0.000000946690255953756
A10: F -1 | B10: 5 | C10: 10.913 | D10: of:=1/[.C10] -> 0.0916338312104829 | E10: of:=[.$B$2]/[.D10] -> 0.00010913 | F10: of:=[.$C$2]*[.E10] -> 468709.78101248 | G10: of:=ROUND([.F10]) -> 468710 | H10: of:=(([.G10]-[.F10])/[.F10]) -> 0.000000467213463086237
A11: F# -1 | B11: 6 | C11: 11.562 | D11: of:=1/[.C11] -> 0.0864902266043937 | E11: of:=[.$B$2]/[.D11] -> 0.00011562 | F11: of:=[.$C$2]*[.E11] -> 496584.11876352 | G11: of:=ROUND([.F11]) -> 496584 | H11: of:=(([.G11]-[.F11])/[.F11]) -> -0.00000023916093073781
A12: G -1 | B12: 7 | C12: 12.25 | D12: of:=1/[.C12] -> 0.0816326530612245 | E12: of:=[.$B$2]/[.D12] -> 0.0001225 | F12: of:=[.$C$2]*[.E12] -> 526133.49376 | G12: of:=ROUND([.F12]) -> 526133 | H12: of:=(([.G12]-[.F12])/[.F12]) -> -0.000000938469050070894
A13: G# -1 | B13: 8 | C13: 12.978 | D13: of:=1/[.C13] -> 0.0770534751117275 | E13: of:=[.$B$2]/[.D13] -> 0.00012978 | F13: of:=[.$C$2]*[.E13] -> 557400.85567488 | G13: of:=ROUND([.F13]) -> 557401 | H13: of:=(([.G13]-[.F13])/[.F13]) -> 0.000000258925185420025
A14: A -1 | B14: 9 | C14: 13.75 | D14: of:=1/[.C14] -> 0.0727272727272727 | E14: of:=[.$B$2]/[.D14] -> 0.0001375 | F14: of:=[.$C$2]*[.E14] -> 590558.0032 | G14: of:=ROUND([.F14]) -> 590558 | H14: of:=(([.G14]-[.F14])/[.F14]) -> -0.00000000541860413073227
A15: A# -1 | B15: 10 | C15: 14.568 | D15: of:=1/[.C15] -> 0.0686436024162548 | E15: of:=[.$B$2]/[.D15] -> 0.00014568 | F15: of:=[.$C$2]*[.E15] -> 625690.83568128 | G15: of:=ROUND([.F15]) -> 625691 | H15: of:=(([.G15]-[.F15])/[.F15]) -> 0.000000262619668731907
A16: B -1 | B16: 11 | C16: 15.434 | D16: of:=1/[.C16] -> 0.0647920176234288 | E16: of:=[.$B$2]/[.D16] -> 0.00015434 | F16: of:=[.$C$2]*[.E16] -> 662885.25246464 | G16: of:=ROUND([.F16]) -> 662885 | H16: of:=(([.G16]-[.F16])/[.F16]) -> -0.000000380857228329629
A17: C 0 | B17: 12 | C17: 16.352 | D17: of:=1/[.C17] -> 0.0611545988258317 | E17: of:=[.$B$2]/[.D17] -> 0.00016352 | F17: of:=[.$C$2]*[.E17] -> 702313.05224192 | G17: of:=ROUND([.F17]) -> 702313 | H17: of:=(([.G17]-[.F17])/[.F17]) -> -0.0000000743855179360981
A18: C# 0 | B18: 13 | C18: 17.324 | D18: of:=1/[.C18] -> 0.0577233895174325 | E18: of:=[.$B$2]/[.D18] -> 0.00017324 | F18: of:=[.$C$2]*[.E18] -> 744060.13435904 | G18: of:=ROUND([.F18]) -> 744060 | H18: of:=(([.G18]-[.F18])/[.F18]) -> -0.000000180575512618875
A19: D 0 | B19: 14 | C19: 18.354 | D19: of:=1/[.C19] -> 0.0544840361774 | E19: of:=[.$B$2]/[.D19] -> 0.00018354 | F19: of:=[.$C$2]*[.E19] -> 788298.29750784 | G19: of:=ROUND([.F19]) -> 788298 | H19: of:=(([.G19]-[.F19])/[.F19]) -> -0.000000377405153501451
A20: D# 0 | B20: 15 | C20: 19.445 | D20: of:=1/[.C20] -> 0.0514271020827976 | E20: of:=[.$B$2]/[.D20] -> 0.00019445 | F20: of:=[.$C$2]*[.E20] -> 835156.3907072 | G20: of:=ROUND([.F20]) -> 835156 | H20: of:=(([.G20]-[.F20])/[.F20]) -> -0.000000467825193589675
A21: E 0 | B21: 16 | C21: 20.601 | D21: of:=1/[.C21] -> 0.0485413329450027 | E21: of:=[.$B$2]/[.D21] -> 0.00020601 | F21: of:=[.$C$2]*[.E21] -> 884806.21264896 | G21: of:=ROUND([.F21]) -> 884806 | H21: of:=(([.G21]-[.F21])/[.F21]) -> -0.000000240333936429536
A22: F 0 | B22: 17 | C22: 21.826 | D22: of:=1/[.C22] -> 0.0458169156052415 | E22: of:=[.$B$2]/[.D22] -> 0.00021826 | F22: of:=[.$C$2]*[.E22] -> 937419.56202496 | G22: of:=ROUND([.F22]) -> 937420 | H22: of:=(([.G22]-[.F22])/[.F22]) -> 0.000000467213463086237
A23: F# 0 | B23: 18 | C23: 23.124 | D23: of:=1/[.C23] -> 0.0432451133021969 | E23: of:=[.$B$2]/[.D23] -> 0.00023124 | F23: of:=[.$C$2]*[.E23] -> 993168.23752704 | G23: of:=ROUND([.F23]) -> 993168 | H23: of:=(([.G23]-[.F23])/[.F23]) -> -0.00000023916093073781
A24: G 0 | B24: 19 | C24: 24.499 | D24: of:=1/[.C24] -> 0.0408179925711254 | E24: of:=[.$B$2]/[.D24] -> 0.00024499 | F24: of:=[.$C$2]*[.E24] -> 1052224.03784704 | G24: of:=ROUND([.F24]) -> 1052224 | H24: of:=(([.G24]-[.F24])/[.F24]) -> -0.0000000359686137428522
A25: G# 0 | B25: 20 | C25: 25.956 | D25: of:=1/[.C25] -> 0.0385267375558638 | E25: of:=[.$B$2]/[.D25] -> 0.00025956 | F25: of:=[.$C$2]*[.E25] -> 1114801.71134976 | G25: of:=ROUND([.F25]) -> 1114802 | H25: of:=(([.G25]-[.F25])/[.F25]) -> 0.000000258925185420025
A26: A 0 | B26: 21 | C26: 27.5 | D26: of:=1/[.C26] -> 0.0363636363636364 | E26: of:=[.$B$2]/[.D26] -> 0.000275 | F26: of:=[.$C$2]*[.E26] -> 1181116.0064 | G26: of:=ROUND([.F26]) -> 1181116 | H26: of:=(([.G26]-[.F26])/[.F26]) -> -0.00000000541860413073227
A27: A# 0 | B27: 22 | C27: 29.135 | D27: of:=1/[.C27] -> 0.0343229792345976 | E27: of:=[.$B$2]/[.D27] -> 0.00029135 | F27: of:=[.$C$2]*[.E27] -> 1251338.7216896 | G27: of:=ROUND([.F27]) -> 1251339 | H27: of:=(([.G27]-[.F27])/[.F27]) -> 0.000000222410123583135
A28: B 0 | B28: 23 | C28: 30.867 | D28: of:=1/[.C28] -> 0.0323970583471021 | E28: of:=[.$B$2]/[.D28] -> 0.00030867 | F28: of:=[.$C$2]*[.E28] -> 1325727.55525632 | G28: of:=ROUND([.F28]) -> 1325728 | H28: of:=(([.G28]-[.F28])/[.F28]) -> 0.000000335471400645666
A29: C 1 | B29: 24 | C29: 32.703 | D29: of:=1/[.C29] -> 0.030578234412745 | E29: of:=[.$B$2]/[.D29] -> 0.00032703 | F29: of:=[.$C$2]*[.E29] -> 1404583.15481088 | G29: of:=ROUND([.F29]) -> 1404583 | H29: of:=(([.G29]-[.F29])/[.F29]) -> -0.000000110218380293531
A30: C# 1 | B30: 25 | C30: 34.648 | D30: of:=1/[.C30] -> 0.0288616947587162 | E30: of:=[.$B$2]/[.D30] -> 0.00034648 | F30: of:=[.$C$2]*[.E30] -> 1488120.26871808 | G30: of:=ROUND([.F30]) -> 1488120 | H30: of:=(([.G30]-[.F30])/[.F30]) -> -0.000000180575512618875
A31: D 1 | B31: 26 | C31: 36.708 | D31: of:=1/[.C31] -> 0.0272420180887 | E31: of:=[.$B$2]/[.D31] -> 0.00036708 | F31: of:=[.$C$2]*[.E31] -> 1576596.59501568 | G31: of:=ROUND([.F31]) -> 1576597 | H31: of:=(([.G31]-[.F31])/[.F31]) -> 0.000000256872507100788
A32: D# 1 | B32: 27 | C32: 38.89 | D32: of:=1/[.C32] -> 0.0257135510413988 | E32: of:=[.$B$2]/[.D32] -> 0.0003889 | F32: of:=[.$C$2]*[.E32] -> 1670312.7814144 | G32: of:=ROUND([.F32]) -> 1670313 | H32: of:=(([.G32]-[.F32])/[.F32]) -> 0.000000130865070369877
A33: E 1 | B33: 28 | C33: 41.203 | D33: of:=1/[.C33] -> 0.024270077421547 | E33: of:=[.$B$2]/[.D33] -> 0.00041203 | F33: of:=[.$C$2]*[.E33] -> 1769655.37497088 | G33: of:=ROUND([.F33]) -> 1769655 | H33: of:=(([.G33]-[.F33])/[.F33]) -> -0.000000211889210543736
A34: F 1 | B34: 29 | C34: 43.653 | D34: of:=1/[.C34] -> 0.0229079330172039 | E34: of:=[.$B$2]/[.D34] -> 0.00043653 | F34: of:=[.$C$2]*[.E34] -> 1874882.07372288 | G34: of:=ROUND([.F34]) -> 1874882 | H34: of:=(([.G34]-[.F34])/[.F34]) -> -0.0000000393213424641918
A35: F# 1 | B35: 30 | C35: 46.249 | D35: of:=1/[.C35] -> 0.0216220891262514 | E35: of:=[.$B$2]/[.D35] -> 0.00046249 | F35: of:=[.$C$2]*[.E35] -> 1986379.42472704 | G35: of:=ROUND([.F35]) -> 1986379 | H35: of:=(([.G35]-[.F35])/[.F35]) -> -0.000000213819693671324
A36: G 1 | B36: 31 | C36: 48.999 | D36: of:=1/[.C36] -> 0.020408579766934 | E36: of:=[.$B$2]/[.D36] -> 0.00048999 | F36: of:=[.$C$2]*[.E36] -> 2104491.02536704 | G36: of:=ROUND([.F36]) -> 2104491 | H36: of:=(([.G36]-[.F36])/[.F36]) -> -0.0000000120537649632867
A37: G# 1 | B37: 32 | C37: 51.913 | D37: of:=1/[.C37] -> 0.0192629977077033 | E37: of:=[.$B$2]/[.D37] -> 0.00051913 | F37: of:=[.$C$2]*[.E37] -> 2229646.37237248 | G37: of:=ROUND([.F37]) -> 2229646 | H37: of:=(([.G37]-[.F37])/[.F37]) -> -0.000000167009658896315
A38: A 1 | B38: 33 | C38: 55 | D38: of:=1/[.C38] -> 0.0181818181818182 | E38: of:=[.$B$2]/[.D38] -> 0.00055 | F38: of:=[.$C$2]*[.E38] -> 2362232.0128 | G38: of:=ROUND([.F38]) -> 2362232 | H38: of:=(([.G38]-[.F38])/[.F38]) -> -0.00000000541860413073227
A39: A# 1 | B39: 34 | C39: 58.27 | D39: of:=1/[.C39] -> 0.0171614896172988 | E39: of:=[.$B$2]/[.D39] -> 0.0005827 | F39: of:=[.$C$2]*[.E39] -> 2502677.4433792 | G39: of:=ROUND([.F39]) -> 2502677 | H39: of:=(([.G39]-[.F39])/[.F39]) -> -0.000000177161943782352
A40: B 1 | B40: 35 | C40: 61.735 | D40: of:=1/[.C40] -> 0.016198266785454 | E40: of:=[.$B$2]/[.D40] -> 0.00061735 | F40: of:=[.$C$2]*[.E40] -> 2651498.0601856 | G40: of:=ROUND([.F40]) -> 2651498 | H40: of:=(([.G40]-[.F40])/[.F40]) -> -0.0000000226987154831004
A41: C 2 | B41: 36 | C41: 65.406 | D41: of:=1/[.C41] -> 0.0152891172063725 | E41: of:=[.$B$2]/[.D41] -> 0.00065406 | F41: of:=[.$C$2]*[.E41] -> 2809166.30962176 | G41: of:=ROUND([.F41]) -> 2809166 | H41: of:=(([.G41]-[.F41])/[.F41]) -> -0.000000110218380293531
A42: C# 2 | B42: 37 | C42: 69.295 | D42: of:=1/[.C42] -> 0.0144310556317195 | E42: of:=[.$B$2]/[.D42] -> 0.00069295 | F42: of:=[.$C$2]*[.E42] -> 2976197.5877632 | G42: of:=ROUND([.F42]) -> 2976198 | H42: of:=(([.G42]-[.F42])/[.F42]) -> 0.000000138511233656299
A43: D 2 | B43: 38 | C43: 73.416 | D43: of:=1/[.C43] -> 0.01362100904435 | E43: of:=[.$B$2]/[.D43] -> 0.00073416 | F43: of:=[.$C$2]*[.E43] -> 3153193.19003136 | G43: of:=ROUND([.F43]) -> 3153193 | H43: of:=(([.G43]-[.F43])/[.F43]) -> -0.0000000602663232003316
A44: D# 2 | B44: 39 | C44: 77.781 | D44: of:=1/[.C44] -> 0.0128566102261478 | E44: of:=[.$B$2]/[.D44] -> 0.00077781 | F44: of:=[.$C$2]*[.E44] -> 3340668.51250176 | G44: of:=ROUND([.F44]) -> 3340669 | H44: of:=(([.G44]-[.F44])/[.F44]) -> 0.000000145928348709161
A45: E 2 | B45: 40 | C45: 82.406 | D45: of:=1/[.C45] -> 0.0121350387107735 | E45: of:=[.$B$2]/[.D45] -> 0.00082406 | F45: of:=[.$C$2]*[.E45] -> 3539310.74994176 | G45: of:=ROUND([.F45]) -> 3539311 | H45: of:=(([.G45]-[.F45])/[.F45]) -> 0.0000000706516768356652
A46: F 2 | B46: 41 | C46: 87.307 | D46: of:=1/[.C46] -> 0.0114538353167558 | E46: of:=[.$B$2]/[.D46] -> 0.00087307 | F46: of:=[.$C$2]*[.E46] -> 3749807.09711872 | G46: of:=ROUND([.F46]) -> 3749807 | H46: of:=(([.G46]-[.F46])/[.F46]) -> -0.0000000258996577415618
A47: F# 2 | B47: 42 | C47: 92.499 | D47: of:=1/[.C47] -> 0.0108109276857047 | E47: of:=[.$B$2]/[.D47] -> 0.00092499 | F47: of:=[.$C$2]*[.E47] -> 3972801.79912704 | G47: of:=ROUND([.F47]) -> 3972802 | H47: of:=(([.G47]-[.F47])/[.F47]) -> 0.0000000505620391329103
A48: G 2 | B48: 43 | C48: 97.998 | D48: of:=1/[.C48] -> 0.010204289883467 | E48: of:=[.$B$2]/[.D48] -> 0.00097998 | F48: of:=[.$C$2]*[.E48] -> 4208982.05073408 | G48: of:=ROUND([.F48]) -> 4208982 | H48: of:=(([.G48]-[.F48])/[.F48]) -> -0.0000000120537649632867
A49: G# 2 | B49: 44 | C49: 103.82 | D49: of:=1/[.C49] -> 0.00963205548063957 | E49: of:=[.$B$2]/[.D49] -> 0.0010382 | F49: of:=[.$C$2]*[.E49] -> 4459035.0467072 | G49: of:=ROUND([.F49]) -> 4459035 | H49: of:=(([.G49]-[.F49])/[.F49]) -> -0.0000000104747326264978
A50: A 2 | B50: 45 | C50: 110 | D50: of:=1/[.C50] -> 0.00909090909090909 | E50: of:=[.$B$2]/[.D50] -> 0.0011 | F50: of:=[.$C$2]*[.E50] -> 4724464.0256 | G50: of:=ROUND([.F50]) -> 4724464 | H50: of:=(([.G50]-[.F50])/[.F50]) -> -0.00000000541860413073227
A51: A# 2 | B51: 46 | C51: 116.54 | D51: of:=1/[.C51] -> 0.00858074480864939 | E51: of:=[.$B$2]/[.D51] -> 0.0011654 | F51: of:=[.$C$2]*[.E51] -> 5005354.8867584 | G51: of:=ROUND([.F51]) -> 5005355 | H51: of:=(([.G51]-[.F51])/[.F51]) -> 0.0000000226240899003914
A52: B 2 | B52: 47 | C52: 123.47 | D52: of:=1/[.C52] -> 0.00809913339272698 | E52: of:=[.$B$2]/[.D52] -> 0.0012347 | F52: of:=[.$C$2]*[.E52] -> 5302996.1203712 | G52: of:=ROUND([.F52]) -> 5302996 | H52: of:=(([.G52]-[.F52])/[.F52]) -> -0.0000000226987154831004
A53: C 3 | B53: 48 | C53: 130.81 | D53: of:=1/[.C53] -> 0.00764467548352572 | E53: of:=[.$B$2]/[.D53] -> 0.0013081 | F53: of:=[.$C$2]*[.E53] -> 5618246.7198976 | G53: of:=ROUND([.F53]) -> 5618247 | H53: of:=(([.G53]-[.F53])/[.F53]) -> 0.000000049855838154248
A54: C# 3 | B54: 49 | C54: 138.59 | D54: of:=1/[.C54] -> 0.00721552781585973 | E54: of:=[.$B$2]/[.D54] -> 0.0013859 | F54: of:=[.$C$2]*[.E54] -> 5952395.1755264 | G54: of:=ROUND([.F54]) -> 5952395 | H54: of:=(([.G54]-[.F54])/[.F54]) -> -0.0000000294883649106033
A55: D 3 | B55: 50 | C55: 146.83 | D55: of:=1/[.C55] -> 0.00681059728938228 | E55: of:=[.$B$2]/[.D55] -> 0.0014683 | F55: of:=[.$C$2]*[.E55] -> 6306300.4807168 | G55: of:=ROUND([.F55]) -> 6306300 | H55: of:=(([.G55]-[.F55])/[.F55]) -> -0.0000000762280203295753
A56: D# 3 | B56: 51 | C56: 155.56 | D56: of:=1/[.C56] -> 0.0064283877603497 | E56: of:=[.$B$2]/[.D56] -> 0.0015556 | F56: of:=[.$C$2]*[.E56] -> 6681251.1256576 | G56: of:=ROUND([.F56]) -> 6681251 | H56: of:=(([.G56]-[.F56])/[.F56]) -> -0.0000000188074956200112
A57: E 3 | B57: 52 | C57: 164.81 | D57: of:=1/[.C57] -> 0.00606759298586251 | E57: of:=[.$B$2]/[.D57] -> 0.0016481 | F57: of:=[.$C$2]*[.E57] -> 7078535.6005376 | G57: of:=ROUND([.F57]) -> 7078536 | H57: of:=(([.G57]-[.F57])/[.F57]) -> 0.0000000564329151699974
A58: F 3 | B58: 53 | C58: 174.61 | D58: of:=1/[.C58] -> 0.00572704885172671 | E58: of:=[.$B$2]/[.D58] -> 0.0017461 | F58: of:=[.$C$2]*[.E58] -> 7499442.3955456 | G58: of:=ROUND([.F58]) -> 7499442 | H58: of:=(([.G58]-[.F58])/[.F58]) -> -0.0000000527433347775836
A59: F# 3 | B59: 54 | C59: 184.99 | D59: of:=1/[.C59] -> 0.00540569760527596 | E59: of:=[.$B$2]/[.D59] -> 0.0018499 | F59: of:=[.$C$2]*[.E59] -> 7945260.0008704 | G59: of:=ROUND([.F59]) -> 7945260 | H59: of:=(([.G59]-[.F59])/[.F59]) -> -0.000000000109549723939082
A60: G 3 | B60: 55 | C60: 195.99 | D60: of:=1/[.C60] -> 0.00510230113781315 | E60: of:=[.$B$2]/[.D60] -> 0.0019599 | F60: of:=[.$C$2]*[.E60] -> 8417706.4034304 | G60: of:=ROUND([.F60]) -> 8417706 | H60: of:=(([.G60]-[.F60])/[.F60]) -> -0.0000000479264045268309
A61: G# 3 | B61: 56 | C61: 207.65 | D61: of:=1/[.C61] -> 0.00481579581025765 | E61: of:=[.$B$2]/[.D61] -> 0.0020765 | F61: of:=[.$C$2]*[.E61] -> 8918499.590144 | G61: of:=ROUND([.F61]) -> 8918500 | H61: of:=(([.G61]-[.F61])/[.F61]) -> 0.0000000459557120466164
A62: A 3 | B62: 57 | C62: 220 | D62: of:=1/[.C62] -> 0.00454545454545455 | E62: of:=[.$B$2]/[.D62] -> 0.0022 | F62: of:=[.$C$2]*[.E62] -> 9448928.0512 | G62: of:=ROUND([.F62]) -> 9448928 | H62: of:=(([.G62]-[.F62])/[.F62]) -> -0.00000000541860413073227
A63: A# 3 | B63: 58 | C63: 233.08 | D63: of:=1/[.C63] -> 0.0042903724043247 | E63: of:=[.$B$2]/[.D63] -> 0.0023308 | F63: of:=[.$C$2]*[.E63] -> 10010709.7735168 | G63: of:=ROUND([.F63]) -> 10010710 | H63: of:=(([.G63]-[.F63])/[.F63]) -> 0.0000000226240899003914
A64: B 3 | B64: 59 | C64: 246.94 | D64: of:=1/[.C64] -> 0.00404956669636349 | E64: of:=[.$B$2]/[.D64] -> 0.0024694 | F64: of:=[.$C$2]*[.E64] -> 10605992.2407424 | G64: of:=ROUND([.F64]) -> 10605992 | H64: of:=(([.G64]-[.F64])/[.F64]) -> -0.0000000226987154831004
A65: C 4 | B65: 60 | C65: 261.63 | D65: of:=1/[.C65] -> 0.00382219164468906 | E65: of:=[.$B$2]/[.D65] -> 0.0026163 | F65: of:=[.$C$2]*[.E65] -> 11236922.9365248 | G65: of:=ROUND([.F65]) -> 11236923 | H65: of:=(([.G65]-[.F65])/[.F65]) -> 0.00000000564880611910484
A66: C# 4 | B66: 61 | C66: 277.18 | D66: of:=1/[.C66] -> 0.00360776390792986 | E66: of:=[.$B$2]/[.D66] -> 0.0027718 | F66: of:=[.$C$2]*[.E66] -> 11904790.3510528 | G66: of:=ROUND([.F66]) -> 11904790 | H66: of:=(([.G66]-[.F66])/[.F66]) -> -0.0000000294883649106033
A67: D 4 | B67: 62 | C67: 293.66 | D67: of:=1/[.C67] -> 0.00340529864469114 | E67: of:=[.$B$2]/[.D67] -> 0.0029366 | F67: of:=[.$C$2]*[.E67] -> 12612600.9614336 | G67: of:=ROUND([.F67]) -> 12612601 | H67: of:=(([.G67]-[.F67])/[.F67]) -> 0.00000000305776719813347
A68: D# 4 | B68: 63 | C68: 311.13 | D68: of:=1/[.C68] -> 0.00321409057307235 | E68: of:=[.$B$2]/[.D68] -> 0.0031113 | F68: of:=[.$C$2]*[.E68] -> 13362931.7480448 | G68: of:=ROUND([.F68]) -> 13362932 | H68: of:=(([.G68]-[.F68])/[.F68]) -> 0.0000000188547846189188
A69: E 4 | B69: 64 | C69: 329.63 | D69: of:=1/[.C69] -> 0.00303370445651185 | E69: of:=[.$B$2]/[.D69] -> 0.0032963 | F69: of:=[.$C$2]*[.E69] -> 14157500.6978048 | G69: of:=ROUND([.F69]) -> 14157501 | H69: of:=(([.G69]-[.F69])/[.F69]) -> 0.0000000213452363721797
A70: F 4 | B70: 65 | C70: 349.23 | D70: of:=1/[.C70] -> 0.00286344243048993 | E70: of:=[.$B$2]/[.D70] -> 0.0034923 | F70: of:=[.$C$2]*[.E70] -> 14999314.2878208 | G70: of:=ROUND([.F70]) -> 14999314 | H70: of:=(([.G70]-[.F70])/[.F70]) -> -0.0000000191889307390024
A71: F# 4 | B71: 66 | C71: 369.99 | D71: of:=1/[.C71] -> 0.00270277575069596 | E71: of:=[.$B$2]/[.D71] -> 0.0036999 | F71: of:=[.$C$2]*[.E71] -> 15890949.4984704 | G71: of:=ROUND([.F71]) -> 15890949 | H71: of:=(([.G71]-[.F71])/[.F71]) -> -0.0000000313681949237437
A72: G 4 | B72: 67 | C72: 391.99 | D72: of:=1/[.C72] -> 0.00255108548687466 | E72: of:=[.$B$2]/[.D72] -> 0.0039199 | F72: of:=[.$C$2]*[.E72] -> 16835842.3035904 | G72: of:=ROUND([.F72]) -> 16835842 | H72: of:=(([.G72]-[.F72])/[.F72]) -> -0.0000000180323857002604
A73: G# 4 | B73: 68 | C73: 415.31 | D73: of:=1/[.C73] -> 0.00240783992680167 | E73: of:=[.$B$2]/[.D73] -> 0.0041531 | F73: of:=[.$C$2]*[.E73] -> 17837428.6770176 | G73: of:=ROUND([.F73]) -> 17837429 | H73: of:=(([.G73]-[.F73])/[.F73]) -> 0.000000018107004462582
A74: A 4 | B74: 69 | C74: 440 | D74: of:=1/[.C74] -> 0.00227272727272727 | E74: of:=[.$B$2]/[.D74] -> 0.0044 | F74: of:=[.$C$2]*[.E74] -> 18897856.1024 | G74: of:=ROUND([.F74]) -> 18897856 | H74: of:=(([.G74]-[.F74])/[.F74]) -> -0.00000000541860413073227
A75: A# 4 | B75: 70 | C75: 466.16 | D75: of:=1/[.C75] -> 0.00214518620216235 | E75: of:=[.$B$2]/[.D75] -> 0.0046616 | F75: of:=[.$C$2]*[.E75] -> 20021419.5470336 | G75: of:=ROUND([.F75]) -> 20021420 | H75: of:=(([.G75]-[.F75])/[.F75]) -> 0.0000000226240899003914
A76: B 4 | B76: 71 | C76: 493.88 | D76: of:=1/[.C76] -> 0.00202478334818174 | E76: of:=[.$B$2]/[.D76] -> 0.0049388 | F76: of:=[.$C$2]*[.E76] -> 21211984.4814848 | G76: of:=ROUND([.F76]) -> 21211984 | H76: of:=(([.G76]-[.F76])/[.F76]) -> -0.0000000226987154831004
A77: C 5 | B77: 72 | C77: 523.25 | D77: of:=1/[.C77] -> 0.00191113234591495 | E77: of:=[.$B$2]/[.D77] -> 0.0052325 | F77: of:=[.$C$2]*[.E77] -> 22473416.37632 | G77: of:=ROUND([.F77]) -> 22473416 | H77: of:=(([.G77]-[.F77])/[.F77]) -> -0.0000000167451177943608
A78: C# 5 | B78: 73 | C78: 554.37 | D78: of:=1/[.C78] -> 0.00180384941465087 | E78: of:=[.$B$2]/[.D78] -> 0.0055437 | F78: of:=[.$C$2]*[.E78] -> 23810010.1988352 | G78: of:=ROUND([.F78]) -> 23810010 | H78: of:=(([.G78]-[.F78])/[.F78]) -> -0.00000000835090787030314
A79: D 5 | B79: 74 | C79: 587.33 | D79: of:=1/[.C79] -> 0.00170262033269201 | E79: of:=[.$B$2]/[.D79] -> 0.0058733 | F79: of:=[.$C$2]*[.E79] -> 25225631.4195968 | G79: of:=ROUND([.F79]) -> 25225631 | H79: of:=(([.G79]-[.F79])/[.F79]) -> -0.0000000166337483961883
A80: D# 5 | B80: 75 | C80: 622.25 | D80: of:=1/[.C80] -> 0.00160707111289675 | E80: of:=[.$B$2]/[.D80] -> 0.0062225 | F80: of:=[.$C$2]*[.E80] -> 26725433.99936 | G80: of:=ROUND([.F80]) -> 26725434 | H80: of:=(([.G80]-[.F80])/[.F80]) -> 0.0000000000239471292668432
A81: E 5 | B81: 76 | C81: 659.26 | D81: of:=1/[.C81] -> 0.00151685222825592 | E81: of:=[.$B$2]/[.D81] -> 0.0065926 | F81: of:=[.$C$2]*[.E81] -> 28315001.3956096 | G81: of:=ROUND([.F81]) -> 28315001 | H81: of:=(([.G81]-[.F81])/[.F81]) -> -0.0000000139717316910836
A82: F 5 | B82: 77 | C82: 698.46 | D82: of:=1/[.C82] -> 0.00143172121524497 | E82: of:=[.$B$2]/[.D82] -> 0.0069846 | F82: of:=[.$C$2]*[.E82] -> 29998628.5756416 | G82: of:=ROUND([.F82]) -> 29998629 | H82: of:=(([.G82]-[.F82])/[.F82]) -> 0.0000000141459264688362
A83: F# 5 | B83: 78 | C83: 739.99 | D83: of:=1/[.C83] -> 0.00135136961310288 | E83: of:=[.$B$2]/[.D83] -> 0.0073999 | F83: of:=[.$C$2]*[.E83] -> 31782328.4936704 | G83: of:=ROUND([.F83]) -> 31782328 | H83: of:=(([.G83]-[.F83])/[.F83]) -> -0.0000000155328582692009
A84: G 5 | B84: 79 | C84: 783.99 | D84: of:=1/[.C84] -> 0.00127552647355196 | E84: of:=[.$B$2]/[.D84] -> 0.0078399 | F84: of:=[.$C$2]*[.E84] -> 33672114.1039104 | G84: of:=ROUND([.F84]) -> 33672114 | H84: of:=(([.G84]-[.F84])/[.F84]) -> -0.00000000308594824616139
A85: G# 5 | B85: 80 | C85: 830.61 | D85: of:=1/[.C85] -> 0.00120393445780812 | E85: of:=[.$B$2]/[.D85] -> 0.0083061 | F85: of:=[.$C$2]*[.E85] -> 35674427.8573056 | G85: of:=ROUND([.F85]) -> 35674428 | H85: of:=(([.G85]-[.F85])/[.F85]) -> 0.00000000399990714165228
A86: A 5 | B86: 81 | C86: 880 | D86: of:=1/[.C86] -> 0.00113636363636364 | E86: of:=[.$B$2]/[.D86] -> 0.0088 | F86: of:=[.$C$2]*[.E86] -> 37795712.2048 | G86: of:=ROUND([.F86]) -> 37795712 | H86: of:=(([.G86]-[.F86])/[.F86]) -> -0.00000000541860413073227
A87: A# 5 | B87: 82 | C87: 932.32 | D87: of:=1/[.C87] -> 0.00107259310108117 | E87: of:=[.$B$2]/[.D87] -> 0.0093232 | F87: of:=[.$C$2]*[.E87] -> 40042839.0940672 | G87: of:=ROUND([.F87]) -> 40042839 | H87: of:=(([.G87]-[.F87])/[.F87]) -> -0.00000000234916430995152
A88: B 5 | B88: 83 | C88: 987.77 | D88: of:=1/[.C88] -> 0.00101238142482562 | E88: of:=[.$B$2]/[.D88] -> 0.0098777 | F88: of:=[.$C$2]*[.E88] -> 42424398.4596992 | G88: of:=ROUND([.F88]) -> 42424398 | H88: of:=(([.G88]-[.F88])/[.F88]) -> -0.0000000108357271462764
A89: C 6 | B89: 84 | C89: 1046.5 | D89: of:=1/[.C89] -> 0.000955566172957477 | E89: of:=[.$B$2]/[.D89] -> 0.010465 | F89: of:=[.$C$2]*[.E89] -> 44946832.75264 | G89: of:=ROUND([.F89]) -> 44946833 | H89: of:=(([.G89]-[.F89])/[.F89]) -> 0.00000000550339091599462
A90: C# 6 | B90: 85 | C90: 1108.7 | D90: of:=1/[.C90] -> 0.000901957247226481 | E90: of:=[.$B$2]/[.D90] -> 0.011087 | F90: of:=[.$C$2]*[.E90] -> 47618302.410752 | G90: of:=ROUND([.F90]) -> 47618302 | H90: of:=(([.G90]-[.F90])/[.F90]) -> -0.00000000862592711373861
A91: D 6 | B91: 86 | C91: 1174.7 | D91: of:=1/[.C91] -> 0.000851281178173151 | E91: of:=[.$B$2]/[.D91] -> 0.011747 | F91: of:=[.$C$2]*[.E91] -> 50452980.826112 | G91: of:=ROUND([.F91]) -> 50452981 | H91: of:=(([.G91]-[.F91])/[.F91]) -> 0.00000000344653551817696
A92: D# 6 | B92: 87 | C92: 1244.5 | D92: of:=1/[.C92] -> 0.000803535556448373 | E92: of:=[.$B$2]/[.D92] -> 0.012445 | F92: of:=[.$C$2]*[.E92] -> 53450867.99872 | G92: of:=ROUND([.F92]) -> 53450868 | H92: of:=(([.G92]-[.F92])/[.F92]) -> 0.0000000000239471292668432
A93: E 6 | B93: 88 | C93: 1318.5 | D93: of:=1/[.C93] -> 0.000758437618505878 | E93: of:=[.$B$2]/[.D93] -> 0.013185 | F93: of:=[.$C$2]*[.E93] -> 56629143.79776 | G93: of:=ROUND([.F93]) -> 56629144 | H93: of:=(([.G93]-[.F93])/[.F93]) -> 0.0000000035713058095428
A94: F 6 | B94: 89 | C94: 1396.9 | D94: of:=1/[.C94] -> 0.000715870856897416 | E94: of:=[.$B$2]/[.D94] -> 0.013969 | F94: of:=[.$C$2]*[.E94] -> 59996398.157824 | G94: of:=ROUND([.F94]) -> 59996398 | H94: of:=(([.G94]-[.F94])/[.F94]) -> -0.0000000026305580751988
A95: F# 6 | B95: 90 | C95: 1480 | D95: of:=1/[.C95] -> 0.000675675675675676 | E95: of:=[.$B$2]/[.D95] -> 0.0148 | F95: of:=[.$C$2]*[.E95] -> 63565515.9808 | G95: of:=ROUND([.F95]) -> 63565516 | H95: of:=(([.G95]-[.F95])/[.F95]) -> 0.000000000302050520481264
A96: G 6 | B96: 91 | C96: 1568 | D96: of:=1/[.C96] -> 0.000637755102040816 | E96: of:=[.$B$2]/[.D96] -> 0.01568 | F96: of:=[.$C$2]*[.E96] -> 67345087.20128 | G96: of:=ROUND([.F96]) -> 67345087 | H96: of:=(([.G96]-[.F96])/[.F96]) -> -0.00000000298878539016812
A97: G# 6 | B97: 92 | C97: 1661.2 | D97: of:=1/[.C97] -> 0.000601974476282206 | E97: of:=[.$B$2]/[.D97] -> 0.016612 | F97: of:=[.$C$2]*[.E97] -> 71347996.721152 | G97: of:=ROUND([.F97]) -> 71347997 | H97: of:=(([.G97]-[.F97])/[.F97]) -> 0.00000000390828061382035
A98: A 6 | B98: 93 | C98: 1760 | D98: of:=1/[.C98] -> 0.000568181818181818 | E98: of:=[.$B$2]/[.D98] -> 0.0176 | F98: of:=[.$C$2]*[.E98] -> 75591424.4096 | G98: of:=ROUND([.F98]) -> 75591424 | H98: of:=(([.G98]-[.F98])/[.F98]) -> -0.00000000541860413073227
A99: A# 6 | B99: 94 | C99: 1864.7 | D99: of:=1/[.C99] -> 0.000536279294256449 | E99: of:=[.$B$2]/[.D99] -> 0.018647 | F99: of:=[.$C$2]*[.E99] -> 80088255.168512 | G99: of:=ROUND([.F99]) -> 80088255 | H99: of:=(([.G99]-[.F99])/[.F99]) -> -0.00000000210407900859174
A100: B 6 | B100: 95 | C100: 1975.5 | D100: of:=1/[.C100] -> 0.000506200961781827 | E100: of:=[.$B$2]/[.D100] -> 0.019755 | F100: of:=[.$C$2]*[.E100] -> 84847078.93248 | G100: of:=ROUND([.F100]) -> 84847079 | H100: of:=(([.G100]-[.F100])/[.F100]) -> 0.000000000795784527168954
A101: C 7 | B101: 96 | C101: 2093 | D101: of:=1/[.C101] -> 0.000477783086478739 | E101: of:=[.$B$2]/[.D101] -> 0.02093 | F101: of:=[.$C$2]*[.E101] -> 89893665.50528 | G101: of:=ROUND([.F101]) -> 89893666 | H101: of:=(([.G101]-[.F101])/[.F101]) -> 0.00000000550339091599462
A102: C# 7 | B102: 97 | C102: 2217.5 | D102: of:=1/[.C102] -> 0.000450958286358512 | E102: of:=[.$B$2]/[.D102] -> 0.022175 | F102: of:=[.$C$2]*[.E102] -> 95240899.7888 | G102: of:=ROUND([.F102]) -> 95240900 | H102: of:=(([.G102]-[.F102])/[.F102]) -> 0.00000000221753453004721
A103: D 7 | B103: 98 | C103: 2349.3 | D103: of:=1/[.C103] -> 0.000425658706848849 | E103: of:=[.$B$2]/[.D103] -> 0.023493 | F103: of:=[.$C$2]*[.E103] -> 100901666.684928 | G103: of:=ROUND([.F103]) -> 100901667 | H103: of:=(([.G103]-[.F103])/[.F103]) -> 0.00000000312256472541107
A104: D# 7 | B104: 99 | C104: 2489 | D104: of:=1/[.C104] -> 0.000401767778224186 | E104: of:=[.$B$2]/[.D104] -> 0.02489 | F104: of:=[.$C$2]*[.E104] -> 106901735.99744 | G104: of:=ROUND([.F104]) -> 106901736 | H104: of:=(([.G104]-[.F104])/[.F104]) -> 0.0000000000239471292668432
A105: E 7 | B105: 100 | C105: 2637 | D105: of:=1/[.C105] -> 0.000379218809252939 | E105: of:=[.$B$2]/[.D105] -> 0.02637 | F105: of:=[.$C$2]*[.E105] -> 113258287.59552 | G105: of:=ROUND([.F105]) -> 113258288 | H105: of:=(([.G105]-[.F105])/[.F105]) -> 0.0000000035713058095428
A106: F 7 | B106: 101 | C106: 2793.8 | D106: of:=1/[.C106] -> 0.000357935428448708 | E106: of:=[.$B$2]/[.D106] -> 0.027938 | F106: of:=[.$C$2]*[.E106] -> 119992796.315648 | G106: of:=ROUND([.F106]) -> 119992796 | H106: of:=(([.G106]-[.F106])/[.F106]) -> -0.0000000026305580751988
A107: F# 7 | B107: 102 | C107: 2960 | D107: of:=1/[.C107] -> 0.000337837837837838 | E107: of:=[.$B$2]/[.D107] -> 0.0296 | F107: of:=[.$C$2]*[.E107] -> 127131031.9616 | G107: of:=ROUND([.F107]) -> 127131032 | H107: of:=(([.G107]-[.F107])/[.F107]) -> 0.000000000302050520481264
A108: G 7 | B108: 103 | C108: 3136 | D108: of:=1/[.C108] -> 0.000318877551020408 | E108: of:=[.$B$2]/[.D108] -> 0.03136 | F108: of:=[.$C$2]*[.E108] -> 134690174.40256 | G108: of:=ROUND([.F108]) -> 134690174 | H108: of:=(([.G108]-[.F108])/[.F108]) -> -0.00000000298878539016812
A109: G# 7 | B109: 104 | C109: 3322.4 | D109: of:=1/[.C109] -> 0.000300987238141103 | E109: of:=[.$B$2]/[.D109] -> 0.033224 | F109: of:=[.$C$2]*[.E109] -> 142695993.442304 | G109: of:=ROUND([.F109]) -> 142695993 | H109: of:=(([.G109]-[.F109])/[.F109]) -> -0.000000003099624624979
A110: A 7 | B110: 105 | C110: 3520 | D110: of:=1/[.C110] -> 0.000284090909090909 | E110: of:=[.$B$2]/[.D110] -> 0.0352 | F110: of:=[.$C$2]*[.E110] -> 151182848.8192 | G110: of:=ROUND([.F110]) -> 151182849 | H110: of:=(([.G110]-[.F110])/[.F110]) -> 0.00000000119590279125266
A111: A# 7 | B111: 106 | C111: 3729.3 | D111: of:=1/[.C111] -> 0.000268146837208055 | E111: of:=[.$B$2]/[.D111] -> 0.037293 | F111: of:=[.$C$2]*[.E111] -> 160172215.369728 | G111: of:=ROUND([.F111]) -> 160172215 | H111: of:=(([.G111]-[.F111])/[.F111]) -> -0.0000000023083154473358
A112: B 7 | B112: 107 | C112: 3951.1 | D112: of:=1/[.C112] -> 0.000253094075067703 | E112: of:=[.$B$2]/[.D112] -> 0.039511 | F112: of:=[.$C$2]*[.E112] -> 169698452.832256 | G112: of:=ROUND([.F112]) -> 169698453 | H112: of:=(([.G112]-[.F112])/[.F112]) -> 0.000000000988482852302056
A113: C 8 | B113: 108 | C113: 4186 | D113: of:=1/[.C113] -> 0.000238891543239369 | E113: of:=[.$B$2]/[.D113] -> 0.04186 | F113: of:=[.$C$2]*[.E113] -> 179787331.01056 | G113: of:=ROUND([.F113]) -> 179787331 | H113: of:=(([.G113]-[.F113])/[.F113]) -> -0.0000000000587362615942396
A114: C# 8 | B114: 109 | C114: 4434.9 | D114: of:=1/[.C114] -> 0.000225484227378295 | E114: of:=[.$B$2]/[.D114] -> 0.044349 | F114: of:=[.$C$2]*[.E114] -> 190477504.610304 | G114: of:=ROUND([.F114]) -> 190477505 | H114: of:=(([.G114]-[.F114])/[.F114]) -> 0.00000000204588989552234
A115: D 8 | B115: 110 | C115: 4698.6 | D115: of:=1/[.C115] -> 0.000212829353424424 | E115: of:=[.$B$2]/[.D115] -> 0.046986 | F115: of:=[.$C$2]*[.E115] -> 201803333.369856 | G115: of:=ROUND([.F115]) -> 201803333 | H115: of:=(([.G115]-[.F115])/[.F115]) -> -0.00000000183275480921349
A116: D# 8 | B116: 111 | C116: 4978 | D116: of:=1/[.C116] -> 0.000200883889112093 | E116: of:=[.$B$2]/[.D116] -> 0.04978 | F116: of:=[.$C$2]*[.E116] -> 213803471.99488 | G116: of:=ROUND([.F116]) -> 213803472 | H116: of:=(([.G116]-[.F116])/[.F116]) -> 0.0000000000239471292668432
A117: E 8 | B117: 112 | C117: 5274 | D117: of:=1/[.C117] -> 0.000189609404626469 | E117: of:=[.$B$2]/[.D117] -> 0.05274 | F117: of:=[.$C$2]*[.E117] -> 226516575.19104 | G117: of:=ROUND([.F117]) -> 226516575 | H117: of:=(([.G117]-[.F117])/[.F117]) -> -0.000000000843382162657988
A118: F 8 | B118: 113 | C118: 5587.7 | D118: of:=1/[.C118] -> 0.000178964511337402 | E118: of:=[.$B$2]/[.D118] -> 0.055877 | F118: of:=[.$C$2]*[.E118] -> 239989887.598592 | G118: of:=ROUND([.F118]) -> 239989888 | H118: of:=(([.G118]-[.F118])/[.F118]) -> 0.00000000167260375383293
A119: F# 8 | B119: 114 | C119: 5919.9 | D119: of:=1/[.C119] -> 0.000168921772327235 | E119: of:=[.$B$2]/[.D119] -> 0.059199 | F119: of:=[.$C$2]*[.E119] -> 254257768.955904 | G119: of:=ROUND([.F119]) -> 254257769 | H119: of:=(([.G119]-[.F119])/[.F119]) -> 0.000000000173430385334507
A120: G 8 | B120: 115 | C120: 6271.9 | D120: of:=1/[.C120] -> 0.000159441317623049 | E120: of:=[.$B$2]/[.D120] -> 0.062719 | F120: of:=[.$C$2]*[.E120] -> 269376053.837824 | G120: of:=ROUND([.F120]) -> 269376054 | H120: of:=(([.G120]-[.F120])/[.F120]) -> 0.000000000602043168582816
A121: G# 8 | B121: 116 | C121: 6644.9 | D121: of:=1/[.C121] -> 0.000150491354271697 | E121: of:=[.$B$2]/[.D121] -> 0.066449 | F121: of:=[.$C$2]*[.E121] -> 285396281.851904 | G121: of:=ROUND([.F121]) -> 285396282 | H121: of:=(([.G121]-[.F121])/[.F121]) -> 0.000000000518913436518721
A122: A 8 | B122: 117 | C122: 7040 | D122: of:=1/[.C122] -> 0.000142045454545455 | E122: of:=[.$B$2]/[.D122] -> 0.0704 | F122: of:=[.$C$2]*[.E122] -> 302365697.6384 | G122: of:=ROUND([.F122]) -> 302365698 | H122: of:=(([.G122]-[.F122])/[.F122]) -> 0.00000000119590279125266
A123: A# 8 | B123: 118 | C123: 7458.6 | D123: of:=1/[.C123] -> 0.000134073418604028 | E123: of:=[.$B$2]/[.D123] -> 0.074586 | F123: of:=[.$C$2]*[.E123] -> 320344430.739456 | G123: of:=ROUND([.F123]) -> 320344431 | H123: of:=(([.G123]-[.F123])/[.F123]) -> 0.000000000813324587709248
A124: B 8 | B124: 119 | C124: 7902.1 | D124: of:=1/[.C124] -> 0.000126548638969388 | E124: of:=[.$B$2]/[.D124] -> 0.079021 | F124: of:=[.$C$2]*[.E124] -> 339392610.697216 | G124: of:=ROUND([.F124]) -> 339392611 | H124: of:=(([.G124]-[.F124])/[.F124]) -> 0.000000000892134821210286
A125: C 9 | B125: 120 | C125: 8372 | D125: of:=1/[.C125] -> 0.000119445771619685 | E125: of:=[.$B$2]/[.D125] -> 0.08372 | F125: of:=[.$C$2]*[.E125] -> 359574662.02112 | G125: of:=ROUND([.F125]) -> 359574662 | H125: of:=(([.G125]-[.F125])/[.F125]) -> -0.0000000000587362615942396
A126: C# 9 | B126: 121 | C126: 8869.8 | D126: of:=1/[.C126] -> 0.000112742113689147 | E126: of:=[.$B$2]/[.D126] -> 0.088698 | F126: of:=[.$C$2]*[.E126] -> 380955009.220608 | G126: of:=ROUND([.F126]) -> 380955009 | H126: of:=(([.G126]-[.F126])/[.F126]) -> -0.000000000579091994191855
A127: D 9 | B127: 122 | C127: 9397.3 | D127: of:=1/[.C127] -> 0.000106413544315921 | E127: of:=[.$B$2]/[.D127] -> 0.093973 | F127: of:=[.$C$2]*[.E127] -> 403610961.707008 | G127: of:=ROUND([.F127]) -> 403610962 | H127: of:=(([.G127]-[.F127])/[.F127]) -> 0.000000000725926755240491
A128: D# 9 | B128: 123 | C128: 9956.1 | D128: of:=1/[.C128] -> 0.000100440935707757 | E128: of:=[.$B$2]/[.D128] -> 0.099561 | F128: of:=[.$C$2]*[.E128] -> 427611238.957056 | G128: of:=ROUND([.F128]) -> 427611239 | H128: of:=(([.G128]-[.F128])/[.F128]) -> 0.000000000100427562597545
A129: E 9 | B129: 124 | C129: 10548.1 | D129: of:=1/[.C129] -> 0.0000948038035285976 | E129: of:=[.$B$2]/[.D129] -> 0.105481 | F129: of:=[.$C$2]*[.E129] -> 453037445.349376 | G129: of:=ROUND([.F129]) -> 453037445 | H129: of:=(([.G129]-[.F129])/[.F129]) -> -0.000000000771185883213065
A130: F 9 | B130: 125 | C130: 11175.3 | D130: of:=1/[.C130] -> 0.0000894830563832738 | E130: of:=[.$B$2]/[.D130] -> 0.111753 | F130: of:=[.$C$2]*[.E130] -> 479975480.229888 | G130: of:=ROUND([.F130]) -> 479975480 | H130: of:=(([.G130]-[.F130])/[.F130]) -> -0.000000000478957845587959
A131: F# 9 | B131: 126 | C131: 11839.8 | D131: of:=1/[.C131] -> 0.0000844608861636176 | E131: of:=[.$B$2]/[.D131] -> 0.118398 | F131: of:=[.$C$2]*[.E131] -> 508515537.911808 | G131: of:=ROUND([.F131]) -> 508515538 | H131: of:=(([.G131]-[.F131])/[.F131]) -> 0.000000000173430385334507
A132: G 9 | B132: 127 | C132: 12543.9 | D132: of:=1/[.C132] -> 0.0000797200232782468 | E132: of:=[.$B$2]/[.D132] -> 0.125439 | F132: of:=[.$C$2]*[.E132] -> 538756402.642944 | G132: of:=ROUND([.F132]) -> 538756403 | H132: of:=(([.G132]-[.F132])/[.F132]) -> 0.000000000662741119991857